{
  "schema": "voicebox.assistant/scenario-trace/v1",
  "catalogVersion": "v1",
  "scenarioId": "text-only-model-interaction",
  "oracleKind": "ExactTrace",
  "inputs": [
    {
      "ordinal": 1,
      "type": "runtime.start",
      "detail": "full-stack-duplex"
    },
    {
      "ordinal": 2,
      "type": "vad.speech.started",
      "detail": "source=manual"
    },
    {
      "ordinal": 3,
      "type": "vad.speaking",
      "detail": "samples=3"
    },
    {
      "ordinal": 4,
      "type": "vad.speech.ended",
      "detail": "durationMs=120"
    },
    {
      "ordinal": 5,
      "type": "runtime.stop",
      "detail": "caller=host"
    }
  ],
  "publicEvents": [
    {
      "publicationSeq": 1,
      "type": "StateChanged",
      "from": "Idle",
      "to": "Listening"
    },
    {
      "publicationSeq": 2,
      "type": "StateChanged",
      "from": "Listening",
      "to": "Recognizing"
    },
    {
      "publicationSeq": 3,
      "type": "UserSpoke",
      "text": "\u4F60\u597D"
    },
    {
      "publicationSeq": 4,
      "type": "StateChanged",
      "from": "Recognizing",
      "to": "Thinking"
    },
    {
      "publicationSeq": 5,
      "type": "StateChanged",
      "from": "Thinking",
      "to": "Speaking"
    },
    {
      "publicationSeq": 6,
      "type": "AssistantText",
      "text": "\u7EAF\u6587\u672C\u56DE\u7B54\u3002",
      "isThinking": false
    },
    {
      "publicationSeq": 7,
      "type": "AssistantResponseGenerated",
      "text": "\u7EAF\u6587\u672C\u56DE\u7B54\u3002"
    },
    {
      "publicationSeq": 8,
      "type": "AssistantReplied",
      "text": "\u7EAF\u6587\u672C\u56DE\u7B54\u3002"
    },
    {
      "publicationSeq": 9,
      "type": "StateChanged",
      "from": "Speaking",
      "to": "Idle"
    },
    {
      "publicationSeq": 10,
      "type": "StateChanged",
      "from": "Idle",
      "to": "Stopped"
    }
  ],
  "providerCalls": [
    {
      "ordinal": 1,
      "type": "audio.start",
      "detail": "count=1"
    },
    {
      "ordinal": 2,
      "type": "asr.finish",
      "detail": "count=1"
    },
    {
      "ordinal": 3,
      "type": "llm.stream",
      "detail": "count=1"
    },
    {
      "ordinal": 4,
      "type": "tts.synthesize",
      "detail": "text=\u7EAF\u6587\u672C\u56DE\u7B54\u3002"
    },
    {
      "ordinal": 5,
      "type": "audio.stop",
      "detail": "count=1"
    }
  ],
  "final": {
    "runtimeState": "Stopped",
    "wakeMode": "Disabled"
  }
}