{
  "schema": "voicebox.assistant/scenario-trace/v1",
  "catalogVersion": "v1",
  "scenarioId": "normal-turn",
  "oracleKind": "ExactTrace",
  "inputs": [
    { "ordinal": 1, "type": "runtime.start", "detail": "full-stack-duplex" },
    { "ordinal": 2, "type": "vad.speech.started", "detail": "source=manual" },
    { "ordinal": 3, "type": "vad.speaking", "detail": "samples=3" },
    { "ordinal": 4, "type": "vad.speech.ended", "detail": "durationMs=120" },
    { "ordinal": 5, "type": "runtime.stop", "detail": "caller=host" }
  ],
  "publicEvents": [
    { "publicationSeq": 1, "type": "StateChanged", "from": "Idle", "to": "Listening" },
    { "publicationSeq": 2, "type": "StateChanged", "from": "Listening", "to": "Recognizing" },
    { "publicationSeq": 3, "type": "UserSpoke", "text": "你好" },
    { "publicationSeq": 4, "type": "StateChanged", "from": "Recognizing", "to": "Thinking" },
    { "publicationSeq": 5, "type": "StateChanged", "from": "Thinking", "to": "Speaking" },
    { "publicationSeq": 6, "type": "AssistantText", "text": "好的。", "isThinking": false },
    { "publicationSeq": 7, "type": "AssistantResponseGenerated", "text": "好的。" },
    { "publicationSeq": 8, "type": "AssistantReplied", "text": "好的。" },
    { "publicationSeq": 9, "type": "StateChanged", "from": "Speaking", "to": "Idle" },
    { "publicationSeq": 10, "type": "StateChanged", "from": "Idle", "to": "Stopped" }
  ],
  "providerCalls": [
    { "ordinal": 1, "type": "audio.start", "detail": "count=1" },
    { "ordinal": 2, "type": "asr.feed", "detail": "samples=3;sha256=85dd1779ed6efc5644f3ef8b25784a4ea351d8f9c57f0fa383673b34974dfdc2" },
    { "ordinal": 3, "type": "asr.finish", "detail": "count=1" },
    { "ordinal": 4, "type": "llm.stream", "detail": "messages=2;roles=System,User" },
    { "ordinal": 5, "type": "tts.synthesize", "detail": "text=好的。" },
    { "ordinal": 6, "type": "playback.enqueue", "detail": "count=1;samples=4" },
    { "ordinal": 7, "type": "audio.stop", "detail": "count=1" }
  ],
  "final": { "runtimeState": "Stopped", "wakeMode": "Disabled" }
}
